{
  "$schema": "./schema/designs.schema.json",
  "whiteboard_minutes": 30,
  "status_options": [
    {
      "id": "todo",
      "label": "To do"
    },
    {
      "id": "attempted",
      "label": "Attempted"
    },
    {
      "id": "ready",
      "label": "Ready"
    }
  ],
  "framework": [
    {
      "id": "clarify",
      "step": "Clarify requirements and constraints",
      "minutes": 4,
      "prompts": [
        "Who are the users, and how many? Peak versus average traffic?",
        "What data, how much, how sensitive? Any compliance (PCI, HIPAA, residency)?",
        "Budget, timeline, and the team's skills. What does success look like?"
      ]
    },
    {
      "id": "simple",
      "step": "Draw the simple version",
      "minutes": 5,
      "prompts": [
        "One box per tier, request path left to right.",
        "Say what each box does in one sentence."
      ]
    },
    {
      "id": "scale",
      "step": "Scale it",
      "minutes": 6,
      "prompts": [
        "Where is the first bottleneck? Stateless tiers scale out; state moves to managed stores.",
        "Caching (CloudFront, ElastiCache), queues to absorb spikes, read replicas."
      ]
    },
    {
      "id": "reliable",
      "step": "Make it reliable",
      "minutes": 5,
      "prompts": [
        "Multi-AZ everywhere it matters. What happens when each box dies?",
        "Retries with backoff, dead-letter queues, health checks, a DR tier tied to RPO and RTO."
      ]
    },
    {
      "id": "secure",
      "step": "Secure it",
      "minutes": 4,
      "prompts": [
        "Private subnets, least-privilege roles, encryption at rest (KMS) and in transit (TLS).",
        "WAF at the edge, CloudTrail for audit, secrets in Secrets Manager."
      ]
    },
    {
      "id": "cost",
      "step": "Cost it",
      "minutes": 4,
      "prompts": [
        "What drives the bill? Right-size, Savings Plans for baseline, Spot or serverless for spikes.",
        "Lifecycle rules for storage; state a rough cost direction, not a fake exact number."
      ]
    },
    {
      "id": "tradeoff",
      "step": "State one tradeoff",
      "minutes": 2,
      "prompts": [
        "\"I chose X over Y because Z; I would revisit if W.\"",
        "Close with the next step: a proof of concept or a Well-Architected review."
      ],
      "differentiator": true
    }
  ],
  "designs": [
    {
      "id": "retail-3tier",
      "title": "3-tier web app for a retailer with Black Friday spikes",
      "prompt": "A retailer's site slows down and sometimes fails on peak days like Black Friday. Design an AWS architecture that stays fast and up.",
      "story": "k8s-autoscaling",
      "clarifying": [
        "How big is the spike versus a normal day, and is the date known in advance?",
        "Is the slowness in the web tier, the database, or checkout?",
        "Global or US-only users? Any PCI scope for payments?"
      ],
      "requirements": {
        "functional": [
          "Browse catalog, search, cart, checkout",
          "Product images and static assets"
        ],
        "non_functional": [
          "Survive a known, many-times-normal spike",
          "Checkout must not lose orders",
          "Page loads fast for users across the country"
        ]
      },
      "components": [
        {
          "name": "Route 53",
          "role": "DNS with health checks"
        },
        {
          "name": "CloudFront + WAF",
          "role": "Caches images and pages at the edge, blocks bots"
        },
        {
          "name": "S3",
          "role": "Product images and static assets"
        },
        {
          "name": "ALB",
          "role": "Spreads traffic across AZs"
        },
        {
          "name": "Auto Scaling group across 2+ AZs",
          "role": "Stateless web and app servers"
        },
        {
          "name": "ElastiCache",
          "role": "Hot catalog reads and a session cache; durable carts remain in a database"
        },
        {
          "name": "Aurora Multi-AZ + read replicas",
          "role": "Orders and catalog; replicas serve reads"
        },
        {
          "name": "SQS",
          "role": "Buffers order processing so checkout accepts orders even when downstream is slow"
        }
      ],
      "flow": [
        "User resolves the domain in Route 53 and hits CloudFront; cached images and pages return from the edge.",
        "Cache misses go to the ALB, then to app servers in an Auto Scaling group across 2 AZs.",
        "App servers read sessions and hot catalog data from ElastiCache, the rest from Aurora read replicas.",
        "Checkout commits the order and an outbox event in the same Aurora transaction. An outbox publisher retries delivery to SQS; idempotent workers track processed event IDs before fulfillment."
      ],
      "scale": [
        "Scheduled scaling to pre-warm before the known peak, plus target tracking on request count",
        "Cache aggressively at CloudFront and ElastiCache so the database sees a fraction of traffic",
        "Queue order fulfillment so spikes do not hit downstream systems directly"
      ],
      "security": [
        "WAF rate limits and bot control at CloudFront",
        "App and database in private subnets",
        "Use a tokenizing payment provider to reduce PCI scope; confirm remaining scope with the compliance owner"
      ],
      "cost": [
        "Savings Plans for the baseline fleet, On-Demand or Spot for the peak",
        "Scale back down after the event"
      ],
      "tradeoff": "Pre-warming with scheduled scaling costs money before the peak, but reactive scaling alone can lag a sudden spike. For a known date I pay for headroom; I would revisit if the spike were unpredictable.",
      "failure_modes": [
        {
          "failure": "One AZ goes down",
          "mitigation": "ALB routes to healthy AZs; Aurora fails over to its standby"
        },
        {
          "failure": "Database overloaded by reads",
          "mitigation": "Cache hits plus read replicas; protect writes"
        },
        {
          "failure": "Fulfillment system slow",
          "mitigation": "SQS buffers orders; dead-letter queue catches poison messages"
        }
      ],
      "followups": [
        "How would you test this before Black Friday?",
        "What if traffic is 10x what they predicted?",
        "How do you keep sessions if an instance dies?"
      ],
      "diagram": {
        "cols": 5,
        "rows": 3,
        "groups": [
          {
            "label": "AWS Region",
            "kind": "region",
            "from": [
              2,
              0
            ],
            "to": [
              4,
              2
            ]
          },
          {
            "label": "Private subnets",
            "kind": "private",
            "from": [
              3,
              0
            ],
            "to": [
              4,
              1
            ]
          }
        ],
        "nodes": [
          {
            "id": "users",
            "label": "Users",
            "cat": "client",
            "at": [
              0,
              1
            ]
          },
          {
            "id": "r53",
            "label": "Route 53",
            "cat": "edge",
            "at": [
              0,
              0
            ]
          },
          {
            "id": "cf",
            "label": "CloudFront + WAF",
            "cat": "edge",
            "at": [
              1,
              1
            ]
          },
          {
            "id": "s3",
            "label": "S3",
            "sub": "images, assets",
            "cat": "storage",
            "at": [
              1,
              0
            ]
          },
          {
            "id": "alb",
            "label": "ALB",
            "cat": "edge",
            "at": [
              2,
              1
            ]
          },
          {
            "id": "app",
            "label": "App servers",
            "sub": "ASG over 2 AZs",
            "cat": "compute",
            "at": [
              3,
              1
            ]
          },
          {
            "id": "cache",
            "label": "ElastiCache",
            "sub": "sessions, catalog",
            "cat": "database",
            "at": [
              3,
              0
            ]
          },
          {
            "id": "db",
            "label": "Aurora",
            "sub": "Multi-AZ, replicas",
            "cat": "database",
            "at": [
              4,
              1
            ]
          },
          {
            "id": "ob",
            "label": "Outbox publisher",
            "cat": "compute",
            "at": [
              4,
              2
            ]
          },
          {
            "id": "q",
            "label": "SQS orders",
            "cat": "integration",
            "at": [
              3,
              2
            ]
          },
          {
            "id": "w",
            "label": "Fulfillment",
            "sub": "idempotent workers",
            "cat": "compute",
            "at": [
              2,
              2
            ]
          }
        ],
        "edges": [
          {
            "from": "users",
            "to": "r53",
            "label": "DNS",
            "step": 1
          },
          {
            "from": "users",
            "to": "cf",
            "label": "HTTPS",
            "step": 1
          },
          {
            "from": "cf",
            "to": "s3",
            "label": "cached",
            "step": 1
          },
          {
            "from": "cf",
            "to": "alb",
            "label": "miss",
            "step": 2
          },
          {
            "from": "alb",
            "to": "app",
            "label": "route",
            "step": 2
          },
          {
            "from": "app",
            "to": "cache",
            "label": "hot reads",
            "step": 3